{
  "curriculumId": "math-foundations-30d",
  "version": "0.1.0",
  "generatedAt": "2026-02-23T23:10:00.000Z",
  "source": {
    "path": "curriculum/math-foundations-30d.json",
    "curriculumVersion": "1.0.0"
  },
  "days": [
    {
      "day": 1,
      "lessonId": "ARITH-001",
      "topic": "Integers, Divisibility, and Prime vs Composite",
      "moduleId": "ARITH",
      "moduleName": "Arithmetic & Modular Intuition",
      "difficulty": 1,
      "passScore": 80,
      "objectives": [
        { "id": "O1", "category": "concept", "text": "Define core objects and notation for integers, divisibility, primes/composites, and gcd intuition." },
        { "id": "O2", "category": "derivation", "text": "Prove basic divisibility claims (e.g., if a|b and a|c then a|(b±c)) with no skipped steps." },
        { "id": "O3", "category": "computation", "text": "Compute prime factorizations and gcds; sanity-check by reconstruction." },
        { "id": "O4", "category": "implementation", "text": "Implement gcd(a,b) with input normalization and edge cases." },
        { "id": "O5", "category": "adversarial", "text": "Identify pitfalls (confusing prime vs coprime; factoring mistakes) and explain how to avoid them." }
      ],
      "constraints": {
        "timeboxMinutes": 75,
        "problemCounts": { "math": 3, "implementation": 1, "adversarial": 1 },
        "allowedLanguages": ["TypeScript", "Python"],
        "allowedResources": ["The generated lesson for this day", "Your own notes"],
        "disallowedResources": ["Copying published solutions", "Using an LLM to write the solution"],
        "responseFormat": { "requireMarkdown": true, "requireLatex": true, "requireCodeFences": true }
      },
      "rubric": {
        "totalPoints": 100,
        "passingScore": 80,
        "dimensions": [
          { "id": "D1", "name": "Mathematical correctness & clarity", "points": 50, "minimumPoints": 30 },
          { "id": "D2", "name": "Implementation correctness & edge cases", "points": 30, "minimumPoints": 18 },
          { "id": "D3", "name": "Adversarial thinking & pitfalls", "points": 20, "minimumPoints": 12 }
        ],
        "masteryGate": "PASS requires score >= 80 AND each rubric dimension score >= its minimumPoints."
      }
    },
    {
      "day": 2,
      "lessonId": "ARITH-002",
      "topic": "Modular Arithmetic — Congruence and Wrap-Around Intuition",
      "moduleId": "ARITH",
      "moduleName": "Arithmetic & Modular Intuition",
      "difficulty": 1,
      "passScore": 80,
      "objectives": [
        { "id": "O1", "category": "concept", "text": "Define congruence mod n, residue classes, and the meaning of a ≡ b (mod n)." },
        { "id": "O2", "category": "derivation", "text": "Prove congruence compatibility with addition/multiplication: if a≡b and c≡d then a+c≡b+d and ac≡bd (mod n)." },
        { "id": "O3", "category": "computation", "text": "Reduce expressions mod n and sanity-check using multiple representatives." },
        { "id": "O4", "category": "implementation", "text": "Implement mod_add and mod_mul with normalization for negative inputs." },
        { "id": "O5", "category": "adversarial", "text": "Explain how incorrect normalization (negative residues / overflow assumptions) can break protocol logic." }
      ],
      "constraints": {
        "timeboxMinutes": 75,
        "problemCounts": { "math": 3, "implementation": 1, "adversarial": 1 },
        "allowedLanguages": ["TypeScript", "Python"],
        "allowedResources": ["The generated lesson for this day", "Your own notes"],
        "disallowedResources": ["Copying published solutions", "Using an LLM to write the solution"],
        "responseFormat": { "requireMarkdown": true, "requireLatex": true, "requireCodeFences": true }
      },
      "rubric": {
        "totalPoints": 100,
        "passingScore": 80,
        "dimensions": [
          { "id": "D1", "name": "Mathematical correctness & clarity", "points": 50, "minimumPoints": 30 },
          { "id": "D2", "name": "Implementation correctness & edge cases", "points": 30, "minimumPoints": 18 },
          { "id": "D3", "name": "Adversarial thinking & pitfalls", "points": 20, "minimumPoints": 12 }
        ],
        "masteryGate": "PASS requires score >= 80 AND each rubric dimension score >= its minimumPoints."
      }
    },
    {
      "day": 3,
      "lessonId": "ARITH-003",
      "topic": "Prime Numbers — Factorization and Why Primes Matter",
      "moduleId": "ARITH",
      "moduleName": "Arithmetic & Modular Intuition",
      "difficulty": 2,
      "passScore": 80,
      "objectives": [
        { "id": "O1", "category": "concept", "text": "State definitions: prime, composite, coprime, and unique factorization (informal statement acceptable)." },
        { "id": "O2", "category": "derivation", "text": "Prove: if p is prime and p|ab then p|a or p|b (Euclid’s lemma) for small-scale reasoning." },
        { "id": "O3", "category": "computation", "text": "Factor integers and use factors to compute gcd/lcm; sanity-check by multiplication." },
        { "id": "O4", "category": "implementation", "text": "Implement is_prime(p) with correct edge cases and complexity awareness." },
        { "id": "O5", "category": "adversarial", "text": "Explain why treating a composite as prime breaks modular inverses and cryptographic assumptions." }
      ],
      "constraints": {
        "timeboxMinutes": 90,
        "problemCounts": { "math": 3, "implementation": 1, "adversarial": 1 },
        "allowedLanguages": ["TypeScript", "Python"],
        "allowedResources": ["The generated lesson for this day", "Your own notes"],
        "disallowedResources": ["Copying published solutions", "Using an LLM to write the solution"],
        "responseFormat": { "requireMarkdown": true, "requireLatex": true, "requireCodeFences": true }
      },
      "rubric": {
        "totalPoints": 100,
        "passingScore": 80,
        "dimensions": [
          { "id": "D1", "name": "Mathematical correctness & rigor", "points": 45, "minimumPoints": 27 },
          { "id": "D2", "name": "Implementation correctness & edge cases", "points": 35, "minimumPoints": 21 },
          { "id": "D3", "name": "Adversarial analysis & mitigations", "points": 20, "minimumPoints": 12 }
        ],
        "masteryGate": "PASS requires score >= 80 AND each rubric dimension score >= its minimumPoints."
      }
    },
    {
      "day": 4,
      "lessonId": "ARITH-004",
      "topic": "Greatest Common Divisor (gcd) and the Euclidean Algorithm",
      "moduleId": "ARITH",
      "moduleName": "Arithmetic & Modular Intuition",
      "difficulty": 2,
      "passScore": 80,
      "objectives": [
        { "id": "O1", "category": "concept", "text": "Define gcd and relate gcd(a,n)=1 to invertibility mod n (preview)." },
        { "id": "O2", "category": "derivation", "text": "Derive Euclidean Algorithm correctness: gcd(a,b)=gcd(b, a mod b)." },
        { "id": "O3", "category": "computation", "text": "Compute gcds by hand with quotient/remainder table; sanity-check using common divisors." },
        { "id": "O4", "category": "implementation", "text": "Implement gcd(a,b) iteratively with signed inputs, zero cases, and normalization." },
        { "id": "O5", "category": "adversarial", "text": "Show how skipping gcd checks causes attempts to invert non-invertible elements." }
      ],
      "constraints": {
        "timeboxMinutes": 90,
        "problemCounts": { "math": 3, "implementation": 1, "adversarial": 1 },
        "allowedLanguages": ["TypeScript", "Python"],
        "allowedResources": ["The generated lesson for this day", "Your own notes"],
        "disallowedResources": ["Copying published solutions", "Using an LLM to write the solution"],
        "responseFormat": { "requireMarkdown": true, "requireLatex": true, "requireCodeFences": true }
      },
      "rubric": {
        "totalPoints": 100,
        "passingScore": 80,
        "dimensions": [
          { "id": "D1", "name": "Mathematical correctness & rigor", "points": 45, "minimumPoints": 27 },
          { "id": "D2", "name": "Implementation correctness & edge cases", "points": 35, "minimumPoints": 21 },
          { "id": "D3", "name": "Adversarial analysis & mitigations", "points": 20, "minimumPoints": 12 }
        ],
        "masteryGate": "PASS requires score >= 80 AND each rubric dimension score >= its minimumPoints."
      }
    },
    {
      "day": 5,
      "lessonId": "ARITH-005",
      "topic": "Extended Euclidean Algorithm — Bezout Coefficients",
      "moduleId": "ARITH",
      "moduleName": "Arithmetic & Modular Intuition",
      "difficulty": 3,
      "passScore": 82,
      "objectives": [
        { "id": "O1", "category": "concept", "text": "State Bézout’s identity and interpret coefficients as a combination of a and b." },
        { "id": "O2", "category": "derivation", "text": "Derive Extended Euclidean Algorithm from Euclid’s algorithm; justify the back-substitution." },
        { "id": "O3", "category": "computation", "text": "Compute (g,x,y) with ax+by=g for multiple pairs; sanity-check by direct substitution." },
        { "id": "O4", "category": "implementation", "text": "Implement egcd(a,b) returning (g,x,y) with correct behavior for negatives and zeros." },
        { "id": "O5", "category": "adversarial", "text": "Explain how sign/normalization bugs in egcd propagate to incorrect inverses." }
      ],
      "constraints": {
        "timeboxMinutes": 105,
        "problemCounts": { "math": 3, "implementation": 1, "adversarial": 1 },
        "allowedLanguages": ["TypeScript", "Python"],
        "allowedResources": ["The generated lesson for this day", "Your own notes"],
        "disallowedResources": ["Copying published solutions", "Using an LLM to write the solution"],
        "responseFormat": { "requireMarkdown": true, "requireLatex": true, "requireCodeFences": true }
      },
      "rubric": {
        "totalPoints": 100,
        "passingScore": 82,